{
	"id": "the-best-corporate-tourism-website",
	"status": "alternate",
	"title": "The Best Corporate, Tourism Website",
	"location": "IR",
	"description": [
		{
			"type": "text",
			"value": "5"
		},
		{
			"type": "sup",
			"value": "th"
		},
		{
			"type": "text",
			"value": " IR Web Festival"
		}
	],
	"date": {
		"datetime": "2012",
		"label": "2012"
	},
	"datePlacement": "inside-container"
}
