{
	"id": "the-world-s-most-influential-mentor",
	"status": "current",
	"title": "🏅 The World’s Most Influential Mentor",
	"location": "UK",
	"description": "Honored in ADPList100 among leading global mentors",
	"date": {
		"datetime": "2026-04",
		"label": "2026"
	},
	"datePlacement": "before-container"
}
