{
	"id": "silver-medal-medallion-for-excellence",
	"status": "alternate",
	"title": "🏆 Silver Medal & Medallion for Excellence",
	"location": "Yazd, IR",
	"description": "WorldSkills IR - IT Software Solutions for Business",
	"date": {
		"datetime": "2010-09-18",
		"label": "2010"
	},
	"datePlacement": "inside-container"
}
