{
	"id": "the-world-s-most-influential-mentor-2",
	"status": "alternate",
	"title": "🏅 The World’s Most Influential Mentor",
	"location": "UK",
	"description": "Honored in ADPList100 from 5,000+ global nominations",
	"date": {
		"datetime": "2024-12",
		"label": "2024"
	},
	"datePlacement": "inside-container"
}
