{
	"id": "uk-global-talent-visa-tech-nation",
	"status": "current",
	"title": "🎖️ UK Global Talent Visa - Tech Nation",
	"location": "UK",
	"description": "Endorsed as an exceptional talent and global leader in tech",
	"date": {
		"datetime": "2024",
		"label": "2024"
	},
	"datePlacement": "inside-container"
}
