{
	"id": "super-mentor-top-1-mentor-in-engineering",
	"status": "alternate",
	"title": "Super Mentor - Top 1% Mentor in Engineering",
	"location": "UK",
	"description": "Mentorship on ADPList, awarded 4x in a row Jul–Oct",
	"date": {
		"datetime": "2024",
		"label": "2024"
	},
	"datePlacement": "inside-container"
}
