{
	"id": "recognized-as-a-national-elite",
	"status": "current",
	"title": "🎖️ Recognized as a National Elite",
	"location": "IR",
	"description": "Awarded by IR National Elites Foundation for excellence",
	"date": {
		"datetime": "2013",
		"label": "2013"
	},
	"datePlacement": "inside-container"
}
