{
	"id": "best-website-builder-and-app-builder-service",
	"status": "alternate",
	"title": "Best Website Builder and App Builder Service",
	"location": "IR",
	"description": "Winner at IR Web and Mobile Festival",
	"date": {
		"datetime": "2022",
		"label": "2022"
	},
	"datePlacement": "inside-container"
}
