{
	"id": "1-mentor-in-europe-adplist-mentor-of-year",
	"status": "current",
	"title": "🥇 #1 Mentor in Europe - ADPList Mentor of Year",
	"location": "UK",
	"description": "Recognized for impactful contributions to mentorship",
	"date": {
		"datetime": "2024-12",
		"label": "2024"
	},
	"datePlacement": "inside-container"
}
